{
  "sender_id": null,
  "master_enable": true,
  "activation": {
    "mode": null,
    "requested_time": null,
    "activation_time": null
  },
  "transport_file": {
    "data": null,
    "type": null
  },
  "transport_params": [{
    "source_ip": null,
    "multicast_ip": null,
    "interface_ip": "172.23.19.35",
    "destination_port": 5004,
    "fec_enabled": false,
    "fec_destination_ip": "172.23.19.35",
    "fec1D_destination_port": 5006,
    "fec2D_destination_port": 5008,
    "rtcp_enabled": false,
    "rtcp_destination_ip": "172.23.19.35",
    "rtcp_destination_port": 5005,
    "rtp_enabled": true
  }]
}
