{
    "sender_id": "5709255c-c0ae-4e1e-99a0-e872e83e48e0",
    "master_enable": true,
    "activation":{
        "mode": "activate_scheduled_relative",
        "requested_time": "2:0",
        "scheduled_time": "1496739064:0"
    },
    "transport_file":{
        "data": null,
        "type": "application/sdp"
    },
    "transport_params": [{
	"src_ip": "172.23.19.48",
	"multicast_group": "232.250.98.80",
        "interface_ip": "172.23.19.35",
	"dest_port": 5000,
        "fec_enabled": true,
	"fec_type": "XOR",
	"fec_mode": "2D",
	"fec1D_dest_port": "auto",
	"fec2D_dest_port": "auto",
        "rtcp_enabled": true,
        "rtcp_dest_ip": "auto",
	"rtcp_dest_port": 5001,
	"rtp_enabled": true
    }, {
	"src_ip": "172.23.20.48",
	"multicast_group": "232.11.105.25",
        "interface_ip": "172.23.20.35",
        "fec_enabled": true,
	"fec_type": "XOR",
	"fec_mode": "2D",
	"fec1D_dest_port": "auto",
	"fec2D_dest_port": "auto",
        "rtcp_enabled": true,
	"rtcp_dest_ip": "auto",
	"rtcp_dest_port": 5001,
	"rtp_enabled": true
    }]
}
