{
  "sender_id": "5709255c-c0ae-4e1e-99a0-e872e83e48e0",
  "master_enable": true,
  "activation": {
    "mode": "activate_immediate",
    "requested_time": null,
    "activation_time": "1496739062:0"
  },
  "transport_file": {
    "data": null,
    "type": null
  },
  "transport_params": [{
    "interface_ip": "192.168.200.15",
    "multicast_ip": "232.105.26.177",
    "source_ip": "192.168.200.10",
    "destination_port": 5000,
    "fec_enabled": true,
    "fec_mode": "2D",
    "fec1D_destination_port": "auto",
    "fec2D_destination_port": "auto",
    "rtcp_enabled": true,
    "rtcp_destination_ip": "232.22.4.59",
    "rtcp_destination_port": 5001,
    "rtp_enabled": true
  }, {
    "interface_ip": "192.168.200.15",
    "multicast_ip": "232.105.26.177",
    "source_ip": "192.168.200.10",
    "destination_port": 5000,
    "fec_enabled": true,
    "fec_mode": "2D",
    "fec1D_destination_port": "auto",
    "fec2D_destination_port": "auto",
    "rtcp_enabled": true,
    "rtcp_destination_ip": "232.79.192.98",
    "rtcp_destination_port": 5001,
    "rtp_enabled": true
  }]
}
